text,author,categories
"You don't need a silver fork to eat good food.","Paul Prudhomme","Good,Good Food"
"I hope the cooks who are working for me now are getting that kind of experience so they can use what they're learning now as a foundation for a great career.","Thomas Keller","Hope,Experience,Great"
"The Gross National Product measures neither our wit nor our courage, neither our wisdom nor our learning, neither our compassion nor our devotion to our country. It measures everything, in short, except that which makes life worthwhile, and it can tell us everything about America - except whether we are proud to be Americans.","Robert Kennedy","Wisdom,Courage"
"When you come off 'The X Factor,' you're more likely to be a failure than a success because people almost want you to fail. There's this kind of feeling that you're separate from everyone else. You get it from artists, people in the industry, people at record labels.","Olly Murs","Success,Want"
"My parents, and librarians along the way, taught me about the space between words; about the margins, where so many juicy moments of life and spirit and friendship could be found. In a library, you could find miracles and truth and you might find something that would make you laugh so hard that you get shushed, in the friendliest way.","Anne Lamott","Truth,Parents"
"I used to pre-rehearse everything and then bring my pre-rehearsed performance to the set. Now, I'm learning to let it happen in the moment. American actors are much better at that than British actors. If I knew how to trust myself, I would have been much more relaxed. Maybe I would have less gray hairs today.","Hugh Grant","Trust,Today,Myself"
"I think about food all the time. It's my passion; it's my profession. But some people think about food all the time because they're hungry. We can put an end to this if we join forces and lend a hand.","Cat Cora","Food,End"
"To enter upon the marriage union is one of the most deeply important events of life. It cannot be too prayerfully treated. Our happiness, our usefulness, our living for God or for ourselves afterwards, are often most intimately connected with our choice. Therefore, in the most prayerful manner, this choice should be made.","George Muller","Happiness,God"
"I like to think I'm a pretty good friend. I love having a good time, and I enjoy being able to share those good times with others.","Jacob Batalon","Good,Friend"
"When my mother had four girls, and she could tell her marriage was falling apart, she went back to college and got her degree in music and education.","Andie MacDowell","Education,Music,Mother"
"I grew and learned, journeyed and understood, that someone who is afraid of failing won't get anywhere, and someone who dares to do it runs the risk of failure if they don't learn, correct their mistakes, and get back up.","Fabrizio Moreira","Mistakes,Learn"
"I don't rely on feng shui. I believe hard work brings us good luck and success.","John Gokongwei","Success,Hard Work"
"All of us are born for a reason, but all of us don't discover why. Success in life has nothing to do with what you gain in life or accomplish for yourself. It's what you do for others.","Danny Thomas","Success,Yourself"
"Well, I think that there's a very thin dividing line between success and failure. And I think if you start a business without financial backing, you're likely to go the wrong side of that dividing line.","Richard Branson","Finance,Business"
"I've learned that mistakes can often be as good a teacher as success.","Jack Welch","Teacher,Mistakes"
"Love me or hate me, both are in my favour. If you love me, I will always be in your heart, and if you hate me, I will be in your mind.","Qandeel Baloch","Heart,Mind"
"Love is the only force capable of transforming an enemy into a friend.","Martin Luther King, Jr.","Love Is,Friend"
"I think with my journey so far, it never felt like an overwhelming, overnight success story. I think that's good for me because I really got to take my time.","Tori Kelly","Success,Journey"
"Study nature, love nature, stay close to nature. It will never fail you.","Frank Lloyd Wright","Love,Learning,Nature"
"In my life I've learned that true happiness comes from giving. Helping others along the way makes you evaluate who you are. I think that love is what we're all searching for. I haven't come across anyone who didn't become a better person through love.","Marla Gibbs","Happiness,Love Is"
"Music is the fourth great material want, first food, then clothes, then shelter, then music.","Christian Nestell Bovee","Music,Great,Want"
"Kids don't need to be taught the value of making; they are natural makers, at least until traditional education makes them afraid of making mistakes. The long-term value of making for kids is in learning to become an active participant in the world around them rather than a consumer of prepackaged products and solutions.","Mark Frauenfelder","Education,Mistakes,World"
"There is a huge difference between failing and failure. Failing is trying something that you learn doesn't work. Failure is throwing in the towel and giving up. True success comes from failing repeatedly and as quickly as possible, before your cash or your willpower runs out.","Jay Samit","Success,Giving"
"Most small business owners are not particularly sophisticated business people. That's not a criticism; they're passionate about cutting hair or cooking food, and that's why they got in the business, not because they have an MBA.","Andrew Mason","Business,People"
"It's so different when you change your hair color, you're treated so differently. It's a very funny experience. It's fun - I love changing up my hair.","Kate Bosworth","Change,Experience"
"I'm frugal. I'm not a very acquisitive woman. I never waste food. If you prepare your own food, you engage with the world, it tastes alive. It tastes good.","Vivienne Westwood","Woman,World"
"While the public school rewards failure by throwing more government money at failing school systems, the voucher system does the opposite.","Fabrizio Moreira","Money,School"
"The art of life is to know how to enjoy a little and to endure very much.","William Hazlitt","Art,Know"
"I understand that there's a certain energy in youth, no question, in terms of pursuing jobs. But there is wisdom in age. It's too bad that the two can't come together because I do think that people are dropped from what they're really good at too soon.","Rene Russo","Wisdom,Age,Together"
"Spain is a fascinating mix of people, languages, culture and food, but if there is one thing all Spaniards share, it's a love of food and drink.","Jose Andres","Love,People"
"Those who have never known the deep intimacy and the intense companionship of mutual love have missed the best thing that life has to give.","Bertrand Russell","Love,Best"
"Sometimes I am happy and sometimes not. I am, after all, a human being, you know. And I am glad that we are sometimes happy and sometimes not. You get your wisdom working by having different emotions.","Yoko Ono","Happy,I Am,Know"
"I don't know if I believe in marriage. I believe in family, love and children.","Penelope Cruz","Family,Children"
"In every aspect of my life, I live under the protection of and in accordance to the laws of this nation. At the end of the day, it's a wildlife biological fact and a conservation fact that the game must be managed. There's only so much habitat, i.e. food, out there.","Shawn Michaels","Day,End"
"I am a woman in process. I'm just trying like everybody else. I try to take every conflict, every experience, and learn from it. Life is never dull.","Oprah Winfrey","Experience,Woman"
"Success is the result of perfection, hard work, learning from failure, loyalty, and persistence.","Colin Powell","Success,Hard Work"
"It's easy to impress me. I don't need a fancy party to be happy. Just good friends, good food, and good laughs. I'm happy. I'm satisfied. I'm content.","Maria Sharapova","Friends,Happy"
"The Universal Zulu Nation stands to acknowledge wisdom, understanding, freedom, justice, and equality, peace, unity, love, and having fun, work, overcoming the negative through the positive, science, mathematics, faith, facts, and the wonders of God, whether we call him Allah, Jehovah, Yahweh, or Jah.","Afrika Bambaataa","Positive,Wisdom"
"I like guitar. It just turned out that it's the instrument I learned to play. I have a lot of respect for it, and I'm learning more and more every day. For me, the classic band setup - guitars, drums, bass - will stay fresh forever. I don't know. I'm still into it.","Mac DeMarco","Respect,Day,Me"
"Children love and want to be loved and they very much prefer the joy of accomplishment to the triumph of hateful failure. Do not mistake a child for his symptom.","Erik Erikson","Love,Children"
"Now you can get artisanal everything - pickles, coffees, house-cured meats, mustard. The pendulum has swung back to this kind of food, and it gives me the greatest hope for the future, especially because we're living in a time with issues like polluted Gulf Coast seafood and food labeled organic that may not really be organic.","Adam Richman","Hope,Future"
"Love is the attempt to form a friendship inspired by beauty.","Marcus Tullius Cicero","Beauty,Love Is"
"Marriage, for a woman at least, hampers the two things that made life to me glorious - friendship and learning.","Jane Harrison","Life,Friendship"
"I don't think men are that attracted by glamour. I think women are attracted by glamour. I think men are attracted by a sense of friendship.","Joanna Lumley","Women,Think"
"It doesn't matter whether you are pursuing success in business, sports, the arts, or life in general: The bridge between wishing and accomplishing is discipline.","Harvey Mackay","Success,Business"
"Imagine all the people living life in peace. You may say I'm a dreamer, but I'm not the only one. I hope someday you'll join us, and the world will be as one.","John Lennon","Hope,Peace,World"
"An unschooled man who knows how to meditate upon the Lord has learned far more than the man with the highest education who does not know how to meditate.","Charles Stanley","Education,Man,Know"
"Around the time I graduated from high school, I decided better to underachieve and have friendship than to overachieve and be alone.","Evangeline Lilly","School,Alone"
"Start with God - the first step in learning is bowing down to God; only fools thumb their noses at such wisdom and learning.","King Solomon","Wisdom,God,Step"
"Nature is a dream state at this point, that we almost don't have a real relationship to it unless it's people living off the land and killing our own food and going for it.","Catherine Opie","Nature,Relationship"
"I think my whole life, because of where I came from, I had a fear of failure.","Howard Schultz","Fear,Think"
"Often the magical elements in my books are standing in for elements of the real world, the small and magical-in-their-own-right sorts of things that we take for granted and no longer pay attention to, like the bonds of friendship that entwine our own lives with those of other people and places.","Charles de Lint","World,People"
"It will give them the opportunity to show themselves worthy of the respect and friendship of peace-loving nations, and in time, to take an honorable place among members of the United Nations.","James F. Byrnes","Respect,Opportunity"
"Some wisdom you must learn from one who's wise.","Euripides","Wisdom,Learn"
"I constantly experience failure in that my work is never as good as I want it to be. So I live with failure.","Jeremy Irons","Good,Experience"
"When a film is successful, you don't need to shout about it from the rooftops. I don't believe in going into overdrive. There's no desperation to be acknowledged as the reason for a film's success.","Emraan Hashmi","Believe,Successful"
"The very nature of finance is that it cannot be profitable unless it is significantly leveraged... and as long as there is debt, there can be failure and contagion.","Alan Greenspan","Nature,Finance"
"Every day is a new opportunity. You can build on yesterday's success or put its failures behind and start over again. That's the way life is, with a new game every day, and that's the way baseball is.","Bob Feller","Success,Day"
"I'm getting to a point where everything is becoming streamlined in my life. I'm learning how to stand onstage for two hours and play in front of thousands of people as if I am completely in the moment every moment.","John Mayer","I Am,People"
"I play- it's kind of like a slice-of-life, LA women in their forties, playing forty kind of what's their friendship like, and what's their life like and so I just play one of the four friends.","Joan Cusack","Women,Friends"
"There is nothing in the world like the devotion of a married woman. It is a thing no married man knows anything about.","Oscar Wilde","Woman,World"
"When you get older, you learn certain life lessons. You apply that wisdom, and suddenly you say, 'Hey, I've got a new lease on this thing. So let's go.'","Robert Redford","Wisdom,Learn"
"Learning by doing is the only way I know how to learn.","Tony Fadell","Learn,Know"
"The cognitive skills prized by the American educational establishment and measured by achievement tests are only part of what is required for success in life. Character skills are equally important determinants of wages, education, health and many other significant aspects of flourishing lives.","James Heckman","Education,Health"
"I've prioritized taking care of my mind, having fun, and doing things that make me laugh. And eating well - as in, really good food, like steak or pasta or fresh vegetables or an amazing dessert. You know, 'treat yo'self.'","Phillipa Soo","Good,Good Food"
"I would love to get married, first of all, from my children's perspective. People don't think of children when they think of gay marriage, but I do have children, and for them to see their family validated as other families are validated and protected by our government, yes.","Judy Gold","Family,Children"
"We don't put gender roles on our marriage and our relationship. If I'm working a lot and Cory's home, he will put Cree to bed, and if dishes need to be washed, he will wash them. So it's not like, 'Oh, I'm going to wait until my wife gets home, and she's going to be doing all that.'","Tia Mowry","Relationship,Home"
"It is easier to have faith that God will support each House of Hospitality and Farming Commune and supply our needs in the way of food and money to pay bills, than it is to keep a strong, hearty, living faith in each individual around us - to see Christ in him.","Dorothy Day","Faith,Money,God"
"Whoso neglects learning in his youth, loses the past and is dead for the future.","Euripides","Future,Past"
"I think it's nice to age gracefully. OK, you lose the youth, a certain stamina and dewy glow, but what you gain on the inside as a human being is wonderful: the wisdom, the acceptance and the peace of mind. It's a fair exchange.","Cherie Lunghi","Age,Peace"
"And I believe that the best learning process of any kind of craft is just to look at the work of others.","Wole Soyinka","Best,Believe"
"Saving our planet, lifting people out of poverty, advancing economic growth... these are one and the same fight. We must connect the dots between climate change, water scarcity, energy shortages, global health, food security and women's empowerment. Solutions to one problem must be solutions for all.","Ban Ki-moon","Change,Women,Health"
"Sex without love is a meaningless experience, but as far as meaningless experiences go its pretty damn good.","Woody Allen","Good,Experience,Love Is"
"When you are learning about a martial art, it is about respect.","Jackie Chan","Learning,Respect,Art"
"I think people should be authentic and who they are. If that calls people to same-sex attraction and same-sex marriage, then they should be true to who they are, and I think that the world could benefit by more love.","Chris Gibson","World,People"
"I like a quiet evening with family or friends over, great food and great discussion and a lot of laughter. That's really what I think fills my tank.","Anna Eshoo","Family,Friends,Great"
"When you hold things back, when you don't commit completely to your ideas and trust completely in your own instincts, you are guaranteeing your own failure - even if you end up having commercial success.","Philipp Meyer","Trust,End"
"Culture, what you believe, what you value, how you live matters. Now, as fundamental as these principles are, they may become topics of democratic debates from time to time, so it is today with the enduring institution of marriage. Marriage is a relationship between a man and a woman.","Mitt Romney","Relationship,Today"
"Love is a better teacher than duty.","Albert Einstein","Teacher,Love Is,Better"
"My parents' long and happy marriage was a great ideal to live up to, but a tough one.","Olivia Williams","Happy,Parents"
"I think every girl needs to love herself, regardless of anything. Like if you're having a bad day, if you don't like your hair, if you don't have the best family situation, whatever, you have to love yourself and you can't do anything until you love yourself first.","Julianne Hough","Family,Best,Day"
"I think that everybody needs four things in life. Everybody needs something to do regardless of age. Everybody needs someone to love. Everybody needs something to hope for, and, of course, everybody needs someone to believe in.","Lou Holtz","Hope,Age"
"I get way too much happiness from good food.","Elizabeth Olsen","Happiness,Good Food"
"The books that help you most are those which make you think that most. The hardest way of learning is that of easy reading; but a great book that comes from a great thinker is a ship of thought, deep freighted with truth and beauty.","Pablo Neruda","Inspirational,Beauty,Truth"
"Food is everything. Food, friends, family: Those are the most important things in life.","Zac Posen","Family,Friends"
"Fact: From quitting smoking to skiing, we succeed to the degree we try, fail, and learn. Studies show that people who worry about mistakes shut down, but those who are relaxed about doing badly soon learn to do well. Success is built on failure.","Martha Beck","Success,Mistakes"
"I believe there are three keys to success. For me it is keeping my priorities in order: It's my faith and my family, and then the business.","Kathy Ireland","Family,Business,Faith"
"Since the dawn of time, traditional marriage - the union between one man and one woman - has been the building block of civilization, and at no point in our nation's history has that foundation been under more severe attack than now.","Jim DeMint","Marriage,History"
"You may have made some mistakes, but just like a parent helps their child when they are learning to walk, God will help you get right back up anytime you fall.","Victoria Osteen","God,Mistakes"
"Throw your dreams into space like a kite, and you do not know what it will bring back, a new life, a new friend, a new love, a new country.","Anais Nin","Inspirational,Love"
"If you're going through friendship issues, I would say, first of all take a step back. How important is the friendship to you? Sometimes, if someone's not being a good friend to you and isn't treating you the way you should be treated, then you kind of have to move on sometimes.","Victoria Justice","Step,Friend"
"Let us be about setting high standards for life, love, creativity, and wisdom. If our expectations in these areas are low, we are not likely to experience wellness. Setting high standards makes every day and every decade worth looking forward to.","Greg Anderson","Wisdom,Day"
"Eventually, we reach the point where we start to realize that we are not going to find peace, contentment, happiness, strength, fearlessness - all of the things that in our heart of hearts we wish we had - outside of us.","Guy Finley","Wisdom,Happiness,Peace"
"If you work just for money, you'll never make it, but if you love what you're doing and you always put the customer first, success will be yours.","Ray Kroc","Success,Money"
"My biggest fear is doing the same things 10 years from now. That would be a failure. It's something you have to constantly reassess, and asking yourself what you are going to do next makes it a good, long full journey.","George Clooney","Journey,Fear,Good"
"The things that will destroy America are prosperity-at-any-price, peace-at-any-price, safety-first instead of duty-first, the love of soft living, and the get-rich-quick theory of life.","Theodore Roosevelt","Love,America"
"Good, better, best. Never let it rest. 'Til your good is better and your better is best.","St. Jerome","Motivational,Best,Better"
"I don't think it's more important to preserve female friendship than a marriage. But I think that there's a place for female friendship that's really important in the lives of all the women I know. As I've gotten older, it's become much more important to me.","Diane English","Women,Me"
"First and foremost I am a chef, whether behind the stove at one of my Northern California restaurants or for the past 15 years in front of the camera on my Food Network cooking shows. Creating new dishes and flavor combinations that bring cooks and our restaurant guests pleasure is my job and I love it.","Tyler Florence","I Am,Past"
"There is a kind of woman who is economically powerful, professionally powerful, who threatens a white male grip on power that has a long historic precedent in the country. Independent women living outside of marriage threaten all kinds of things about the way power is supposed to work.","Rebecca Traister","Women,Power"
"In 1977 we played America and Europe three times, and Japan - my marriage suffered as a result. My then wife took the kids to Canada to be near her parents.","Phil Collins","Parents,America"
"The secret of my success is that I make other people money. And, never ever, ever, ever be ashamed about trying to earn as much as possible for yourself, if the person you're working with is also making money. That's life!","Simon Cowell","Money,Yourself"
"If you've gone into a marriage and you haven't been clear about how you're going to handle money, how you want to raise kids, who is going to work or stay home or what have you, then you've set yourself up for failure.","Phil McGraw","Work,Home"
"Success comes to those who dedicate everything to their passion in life. To be successful, it is also very important to be humble and never let fame or money travel to your head.","A. R. Rahman","Success,Money"
"Remembering that I'll be dead soon is the most important tool I've ever encountered to help me make the big choices in life. Because almost everything - all external expectations, all pride, all fear of embarrassment or failure - these things just fall away in the face of death, leaving only what is truly important.","Steve Jobs","Death,Fear"
"I remember once in junior high school, on a Friday, my mom came home from work and said to my brother and I, 'You know, between us, we have only 27 cents, but we have food in the refrigerator, we have our little garden out back, and we're happy, so we are rich.'","John Paul DeJoria","Home,Happy"
"The first step toward success is taken when you refuse to be a captive of the environment in which you first find yourself.","Mark Caine","Motivational,Yourself,Step"
"When you're a father in a marriage, you sort of become the mother's assistant. And you sort of get a list from her every day and you run down the list and it feels very much like a chore.","Louis C. K.","Father,Mother,Day"
"Even where friendship is concerned, it takes me a long time to trust people.","Namie Amuro","Friendship,Trust"
"Business, you know, may bring you money, but friendship hardly ever does.","Jane Austen","Money,Know"
"I think that we have a great opportunity to impart our wisdom and our knowledge and our experience to this younger generation. It may be different times, but experience transcends time, and wisdom transcends time.","Victoria Osteen","Wisdom,Knowledge"
"When love and skill work together, expect a masterpiece.","John Ruskin","Success,Together"
"Why would anyone walk through life satisfied with the light from the candle of their own understanding when, by reaching out to our Heavenly Father, they could experience the bright sun of spiritual knowledge that would expand their minds with wisdom and fill their souls with joy?","Dieter F. Uchtdorf","Knowledge,Father"
"I think my biggest learning experience is that it's okay to be who you are - you don't have to exactly fit the mold of what people think a certain kind of career is. I think that discovery - of really knowing who I am and being okay with that and loving myself - was amazing.","Dree Hemingway","Experience,Myself,I Am"
"I'm most proud of the blessings that God has bestowed upon me, in my life. He's given me the vision to truly see that you can fall down, but you can still get back up. Hopefully I'll learn from my mistakes and have the opportunity to strengthen and improve the next thing I do.","Martin Lawrence","God,Mistakes"
"Most artists, you know, you spend their entire lives learning how to play music and write songs, and they don't really know how the music business works.","Moby","Music,Business,Know"
"Whether it's learning to hit a backhand in tennis, learning high school chemistry, or getting better at ski racing, I really believe with hard work and analytic preparation, you can skip a few steps and find the faster way.","Mikaela Shiffrin","Hard Work,School"
"No woman ever hates a man for being in love with her, but many a woman hate a man for being a friend to her.","Alexander Pope","Man,Woman"
