text,author,categories
"I'm so single. It's funny. I'm usually a relationship girl. I love being in love and having a partner in crime. But it's good to be your own partner in crime. God, that makes me sound like I have multiple-personality disorder.","Brittany Snow","Relationship,Good"
"Clearly older women and especially older women who have led an active life or elder women who successfully maneuver through their own family life have so much to teach us about sharing, patience, and wisdom.","Alice Walker","Family,Women"
"We provide food that customers love, day after day after day. People just want more of it.","Ray Kroc","Food,Day,People"
"I'm very accepting with my age. It's like notches on your belt: experience, wisdom, and a different kind of beauty. There comes a day when you've become comfortable in your skin.","Zoe Saldana","Beauty,Age,Day"
"It's like, 'Oh, well of course you want gay marriage, you're gay.' I think when heterosexual people are talking to their peers and they're like, 'This is an equal rights thing,' it's a little bit easier.","Jillian Michaels","Marriage,People,Think"
"In the transmission of human culture, people always attempt to replicate, to pass on to the next generation the skills and values of the parents, but the attempt always fails because cultural transmission is geared to learning, not DNA.","Gregory Bateson","Learning,Parents,People"
"No skill shapes a child's future success in school or in life more than the ability to read.","Bob Riley","Future,School"
"But, if you observe children learning in their first few years of life, you can see that they can and do learn on their own - we leave them alone to crawl, walk, talk, and gain control over their bodies. It happens without much help from parents.","Daniel Greenberg","Children,Parents"
"Even in the common affairs of life, in love, friendship, and marriage, how little security have we when we trust our happiness in the hands of others!","William Hazlitt","Friendship,Marriage"
"My argument is simple, which is, that for several thousand years in Western civilization, marriage has been the union of one man and one woman. Research is overwhelming that children need mothers and fathers.","Gary Bauer","Marriage,Children,Woman"
"My theory on life is that life is beautiful. Life doesn't change. You have a day, and a night, and a month, and a year. We people change - we can be miserable or we can be happy. It's what you make of your life.","Mohammed bin Rashid Al Maktoum","Change,Beautiful,Happy"
"Through consciousness, our minds have the power to change our planet and ourselves. It is time we heed the wisdom of the ancient indigenous people and channel our consciousness and spirit to tend the garden and not destroy it.","Bruce Lipton","Change,Power"
"We've never been people that go around and confront people that have been financially successful and say, 'We hate you. We envy you because of how well you're doing.'","Marco Rubio","Successful,People"
"After I won the Oscar, my salary doubled, my friends tripled, my children became more popular at school, my butcher made a pass at me, and my maid hit me up for a raise.","Shirley Jones","Children,Friends,School"
"There are good intentions behind many people's conversion to veganism, including an admirable devotion to the well-being of animals and a justified skepticism about the crap the USDA allows manufacturers to put in our food. But it's hard to ignore the often sanctimonious nature of what some nutritionists view as an 'extremist' way of eating.","Julie Klausner","Food,Nature,People"
"Start with God - the first step in learning is bowing down to God; only fools thumb their noses at such wisdom and learning.","King Solomon","Wisdom,God,Step"
"I have a terrific marriage, but unlike a lot of relationships where they ebb and flow, no matter what happens you fall deeper and deeper in love every day. It's kind of the best thing that can happen to you. It's thrilling.","Hugh Jackman","Marriage,Best,Day"
"It is one of the severest tests of friendship to tell your friend his faults. So to love a man that you cannot bear to see a stain upon him, and to speak painful truth through loving words, that is friendship.","Henry Ward Beecher","Friendship,Truth,Man"
"Only solitary men know the full joys of friendship. Others have their family; but to a solitary and an exile, his friends are everything.","Willa Cather","Family,Friends"
"As an actor, you just want to work, and then you just want to be on a show or have a job that you love, and you hope that job will last - those things have happened. To have that platform to then talk about something that is very personal to me like marriage equality, it feels like a gift. I try and really respect that voice and not abuse it.","Jesse Tyler Ferguson","Marriage,Work,Hope"
"For it is mutual trust, even more than mutual interest that holds human associations together. Our friends seldom profit us but they make us feel safe. Marriage is a scheme to accomplish exactly that same end.","H. L. Mencken","Marriage,Trust,Together"
"A lot of people tell me a lot of things about my conduct, my game, my future... but I try to stay away from their words of wisdom. I don't let it distract me. On the field, you will be facing the ball alone. If you fail, you will the only one to blame. So, you should be the one deciding for yourself.","Virat Kohli","Future,Alone,Yourself"
"In order to succeed you must fail, so that you know what not to do the next time.","Anthony J. D'Angelo","Success,Know"
"My decision to end my marriage was such a risk to lose ratings and lose my fan base. I had to take that risk for my inner peace and to be happy with myself.","Kim Kardashian","Peace,Happy,Myself"
"To these ideals which were instilled in me when I was a youth, I attribute in a large degree the success that was mine on the bicycle tracks of the world.","Major Taylor","World,Me"
"I am not someone who is ashamed of my past. I'm actually really proud. I know I made a lot of mistakes, but they, in turn, were my life lessons.","Drew Barrymore","Mistakes,I Am,Past"
"I think we do need to try to not just rely on the central bank to, in its wisdom, adjust interest rates, but allow for people to avoid being exposed to inflation risk.","Robert J. Shiller","People,Think"
"You know, failure hurts. Any kind of failure stings. If you live in the sting, you will - undoubtedly - fail. My way of getting past the sting is to say no, I'm just not going to let this get me down.","Sonia Sotomayor","Past,Me,Know"
"Failure isn't an option. I've erased the word 'fear' from my vocabulary, and I think when you erase fear, you can't fail.","Alicia Keys","Fear,Think"
"Life is best when you are in love.","Michael Moriarty","Love,Best"
"When you accept that failure is a good thing, it can actually be a huge propeller toward success.","Whitney Wolfe","Success,Good"
"I felt like a failure for so long because I wasn't able to access myself in the way I knew I would have if I was going to make music that mattered. I knew I was going to have to learn how to be honest.","John Grant","Music,Myself"
"Spiritually, we have marginalized the Bible. We've trivialized marriage, and we've neutralized the church. America today is in great turmoil. It feels like the soul of our nation has been taken from us.","David Jeremiah","Marriage,Today,America"
"I can make dressing - or stuffing. Y'all call it stuffing up here, we call it dressing down there. It's really good dressing. That family recipe was passed on, and I love to make that.","Edie Brickell","Food,Family,Good"
"Yom Kippur, the Day of Atonement, is the holy of holies of Jewish time. It is that rarest of phenomena, a Jewish festival without food. Instead it is a day of fasting and prayer, introspection and self-judgment when, collectively and repeatedly, we confess our sins and pray to be written into God's Book of Life.","Jonathan Sacks","Life,Day"
"Some argue that now isn't the time to push the green agenda - that all efforts should be on preventing a serious recession. That is a false choice. It fails to recognise that climate change and our carbon reliance is part of problem - high fuel prices and food shortages due to poor crop yields compound today's financial difficulties.","Lucy Powell","Change,Today"
"Success in its highest and noblest form calls for peace of mind and enjoyment and happiness which come only to the man who has found the work that he likes best.","Napoleon Hill","Work,Happiness,Peace"
"A man may do worse than make what the world calls a not wholly happy marriage.","Thomas Bailey Aldrich","Marriage,Happy,World"
"After graduating college, I was coming out of a routine I'd been in for several years, all the way back to high school. It was a year-round process of constantly having to work and be disciplined, and I was able to understand and connect the dots between all those characteristics - especially hard work and success.","Sam Hunt","Work,Hard Work,School"
"Success is peace of mind which is a direct result of self-satisfaction in knowing you did your best to become the best you are capable of becoming.","John Wooden","Peace,Best,Mind"
"Tons of comedians have said, 'I grew up learning from Bill Cosby. He's great.' But that respect doesn't mean much to the young people. They like their ginger ale with hot sauce.","Bill Cosby","Respect,Great,People"
"School is where children spend most of their time, and it is where we lay the foundation for healthy habits. That's why New Jersey is the first state to adopt a comprehensive school nutrition policy that bans candy, soda, and other junk food.","Richard J. Codey","Children,School"
"I don't ever want to stop learning. And I really want to learn French fluently. It would be great to go and live in France.","Alexa Chung","Great,Learn,Want"
"Achievers have an enabling attitude, realism, and a conviction that they themselves were the laboratory of innovation. Their ability to change themselves is central to their success. They have learned to conserve their energy by minimizing the time spent in regret or complaint. Every event is a lesson to them, every person a teacher.","Marilyn Ferguson","Change,Teacher,Time"
"The right of nature... is the liberty each man hath to use his own power, as he will himself, for the preservation of his own nature; that is to say, of his own life.","Thomas Hobbes","Nature,Power,Man"
"I never did any training in journalism or in finance, so I really was in the deep end. I got very good at going to press conferences and nodding. I'd figure it out when I got back to the office. Charts and numbers. I've never been great with facts, ever, my whole life. For a journalist, that's not a very good trait.","Sophie Kinsella","Finance,Great"
"Enjoy failure and learn from it. You can never learn from success.","James Dyson","Success,Learn"
"Since love grows within you, so beauty grows. For love is the beauty of the soul.","Saint Augustine","Beauty,Love Is"
"The golden opportunity you are seeking is in yourself. It is not in your environment; it is not in luck or chance, or the help of others; it is in yourself alone.","Orison Swett Marden","Opportunity,Alone,Yourself"
"Fear makes strangers of people who would be friends.","Shirley MacLaine","Friendship,Fear,Friends"
"I'm not ashamed to be me. More than anyone else I know, I love my life and accept myself. What's wrong with being unique? I am proud of everything that I am and will become.","Johnny Weir","Myself,I Am"
"People always accuse me of being motivational in a way, like it was a bad thing, but that's just how I was raised. My mom raised me in a positive environment, with lots of love in my heart, and that reflects in my music.","Lenny Kravitz","Motivational,Positive,Music"
"He that loves not his wife and children feeds a lioness at home, and broods a nest of sorrows.","Jeremy Taylor","Home,Children"
"Christian, learn from Christ how you ought to love Christ. Learn a love that is tender, wise, strong; love with tenderness, not passion, wisdom, not foolishness, and strength, lest you become weary and turn away from the love of the Lord.","Saint Bernard","Wisdom,Love"
"There are only really a few stories to tell in the end, and betrayal and the failure of love is one of those good stories to tell.","Sean Lennon","Love,Good,Love Is"
"I love dogs. They live in the moment and don't care about anything except affection and food. They're loyal and happy. Humans are just too damn complicated.","David Duchovny","Food,Happy"
"Nobody can predict the future. You just have to give your all to the relationship you're in and do your best to take care of your partner, communicate and give them every last drop of love you have. I think one of the most important things in a relationship is caring for your significant other through good times and bad.","Nick Cannon","Relationship,Future,Best"
"No better way is there to learn to love Nature than to understand Art. It dignifies every flower of the field. And, the boy who sees the thing of beauty which a bird on the wing becomes when transferred to wood or canvas will probably not throw the customary stone.","Oscar Wilde","Nature,Art,Beauty"
"It is a truth universally acknowledged, that a single man in possession of a good fortune, must be in want of a wife.","Jane Austen","Marriage,Truth,Man"
"Success is no accident. It is hard work, perseverance, learning, studying, sacrifice and most of all, love of what you are doing or learning to do.","Pele","Learning,Work,Success"
"It's all about quality of life and finding a happy balance between work and friends and family.","Philip Green","Work,Family,Friends"
"I can pick good food, but I can't pick a good man.","Debbie Reynolds","Food,Man,Good Food"
"Every time you go out there to do something, you wonder if you can do it. There's no assured success. There's no secret recipe for success. Every time you go out there, you go out there with the possibility of great failure.","Mel Gibson","Success,Time,Great"
"Happy is the man who finds a true friend, and far happier is he who finds that true friend in his wife.","Franz Schubert","Marriage,Happy"
"I am deeply spiritual; I revel in those things that make for good - the things that we can do to shed a little light, to help place an oft-dissonant universe back in tune with itself... Long live art, long live friendship, long live the joy of life!","Jessye Norman","Friendship,Art"
"Love is a strange emotion. It is ever evolving. Lust is transient. With time, one realizes that love and togetherness are two different things. Very few people are lucky enough to experience the two emotions simultaneously.","Randeep Hooda","Time,Experience,Love Is"
"True friendship multiplies the good in life and divides its evils. Strive to have friends, for life without friends is like life on a desert island... to find one real friend in a lifetime is good fortune; to keep him is a blessing.","Baltasar Gracian","Friendship,Friends"
"Whatever you do to gain success, you have to hang in there and hope good things happen. Always think positive.","Don Rickles","Success,Positive,Hope"
"Success? You can't get a big head about it. When people stare at me, they could be whispering to their friend, 'That guy sucks! Have you seen him before? He's horrible.'","David Spade","People,Me,Friend"
"I think I got a lot of life skills; I got a lot of wisdom; I've seen a lot of bad things happen to a lot of good people.","Young Jeezy","Wisdom,People"
"I see people around me with very unhappy love lives, who may have held out for that perfect somebody. And the failure to achieve that brings along a lot of bitterness which is very unattractive; therefore they're probably less likely to achieve it.","David Thewlis","Love,People,Me"
"We have friends in Italy who have these old stoves, and they turn out the most beautiful food. All you really need is time, the best ingredients, and love.","Debi Mazar","Food,Time,Friends"
"Where is instruction in relationships, in the management of career, in the raising of children, in the pursuit of friendship, in the wise approach to anxiety and death? All this sort of stuff I craved to learn about when I was a student and down to this day.","Alain de Botton","Death,Children,Day"
"Your success and happiness lies in you. Resolve to keep happy, and your joy and you shall form an invincible host against difficulties.","Helen Keller","Success,Happiness,Happy"
"A youth, when at home, should be filial and, abroad, respectful to his elders. He should be earnest and truthful. He should overflow in love to all and cultivate the friendship of the good. When he has time and opportunity, after the performance of these things, he should employ them in polite studies.","Confucius","Friendship,Time,Home"
"If elected Speaker, I promise you that we will have the courage to lead the fight for our conservative principles and make our case to the American people. But we will also have the wisdom to listen to our constituents and each other so that we always move forward together.","Kevin McCarthy","Courage,Together,American"
"I consider myself an atheist. My wife is Jewish. And I'm fine with my son being raised as a Jew. He's learning Hebrew and is really into it. I will talk to my own son about my atheism when the time is right. But there's a great tradition of Jewish atheism, there are no better atheists in the world than the Jews.","Paul Giamatti","Time,Myself,Great"
"Learning something new is a fabulous way to be refreshed. When work can grind you down, something about learning a new activity thrills the soul. It reminds you that the world is bigger than your desk and your to-do list.","John Ortberg","Work,World"
"Success is when you see something, and you say, 'I want to do that,' and then you do it. It's being happy with what you do and doing what you love every day.","Alessia Cara","Success,Happy,Day"
"I really love good food occasionally, but I need time to enjoy it, and I need to be hungry.","Clare Balding","Food,Time,Good"
"The world of learning is so broad, and the human soul is so limited in power!","Maria Mitchell","Power,World"
"I feel blessed - I am a woman who has been able to work in the entertainment business for five decades. I don't want to age, but I would never take back a year for the wisdom I've gained in that time.","Marie Osmond","Wisdom,Work,Time"
"I've been very lucky to have achieved a lot of the things that I dreamt of achieving as a young man. But, at the end of the day - and I truly believe this - it is not about achieving great wealth or success. Because they don't bring happiness, ultimately.","Leonardo DiCaprio","Happiness,Day,Great"
"I love being challenged and defending my positions and, when I'm wrong, learning from the exchange. It makes me smarter and better as a businessperson.","Mark Cuban","Learning,Me,Better"
"If there is such a thing as a good marriage, it is because it resembles friendship rather than love.","Michel de Montaigne","Friendship,Marriage,Good"
"Be greedy for social change, and your life will be endlessly enriched. The only failure lies in not trying, or giving up.","Ann Cotton","Change,Giving"
"Your work is going to fill a large part of your life, and the only way to be truly satisfied is to do what you believe is great work. And the only way to do great work is to love what you do. If you haven't found it yet, keep looking. Don't settle. As with all matters of the heart, you'll know when you find it.","Steve Jobs","Inspirational,Work"
"God lets you be successful because he trusts you that you will do the right thing with it. Now, does he get disappointed often? All the time, because people get there and they forget how they got it.","Steve Harvey","Time,God,Successful"
"I founded Atari in my garage in Santa Clara while at Stanford. When I was in school, I took a lot of business classes. I was really fascinated by economics. You end up having to be a marketeer, finance maven and a little bit of a technologist in order to get a business going.","Nolan Bushnell","Business,School,End"
"The experience gathered from books, though often valuable, is but the nature of learning; whereas the experience gained from actual life is one of the nature of wisdom.","Samuel Smiles","Wisdom,Life,Nature"
"I love cookbooks for completely different reasons. I love 'The Harry's Bar Cookbook' and Marco-Pierre White's 'White Heat' for their feel. For pure learning, Gray Kunz wrote a great cookbook, 'The Elements of Taste', published in 2001. The first time I read Charlie Trotter's, the Chicago chef's first cookbook, I was blown away.","Marcus Samuelsson","Learning,Time,Great"
"A good youth ought to have a fear of God, to be subject to his parents, to give honor to his elders, to preserve his purity; he ought not to despise humility, but should love forbearance and modesty. All these are an ornament to youthful years.","Saint Ambrose","Fear,Good,God"
"It is a full time job being honest one moment at a time, remembering to love, to honor, to respect. It is a practice, a discipline, worthy of every moment.","Jasmine Guy","Marriage,Respect,Time"
"I could talk food all day. I love good food.","Tom Brady","Food,Good,Day"
"If the chemistry is right between star and photographer and the geometry of the pictures pleases the star, often the two people end up with a long-term professional friendship during which they continue to work together and to produce highly personal images.","Eve Arnold","Friendship,Together,End"
"Children themselves know they are being cheated. Ultimately we owe it to our children. They are in school for 190 days a year. Every moment they spend learning is precious. If a year goes by and they are not being stretched and excited, that blights their life.","Michael Gove","Life,Children,School"
"I promised her an interesting life and good food, and the rest is history.","Bob Ehrlich","Food,Life,History"
"I have a very happy marriage and friends who keep my feet on the ground. But looking for satisfaction in life is difficult. Maybe being happy is as simple as not being unhappy.","Jasper Carrott","Marriage,Friends,Happy"
"When the Nobel Peace Prize Committee designated me the recipient of the 1970 award for my contribution to the 'green revolution,' they were in effect, I believe, selecting an individual to symbolize the vital role of agriculture and food production in a world that is hungry, both for bread and for peace.","Norman Borlaug","Peace,World,Believe"
"Those who decide to use leisure as a means of mental development, who love good music, good books, good pictures, good plays, good company, good conversation - what are they? They are the happiest people in the world.","William Lyon Phelps","Music,Good,World"
"It's always the big question in our lives if you have a lot of success. What do you do with it? Buy more houses, buy more cars, buy more stuff, be wealthy and distant and unengaged? Or do you take all that good fortune that has come towards you and spread the love, do something with it?","Kevin Spacey","Success,Love,Good"
"A basic rule of life for reporters is that you should spend your time talking with and learning about people who are not sending you press releases, rather than those who are.","James Fallows","Life,Time,People"
"Right from my childhood, I have believed in a Supreme Power. I don't know whether it has form, or it is formless. I am a high school dropout. How come life has given me so much? It's not my intelligence, it's not my abilities. This understanding makes me scared even in success. I don't own my success. Neither do I own my failure.","Pawan Kalyan","Life,Success,School"
"I'm a really nice guy when you meet me, and that surprises a lot of people. I'm not that eccentric in real life - and certainly not that disrespectful. In my own time, I like to just chill out with friends and not get in people's faces.","KSI","Time,Friends,People"
"Our way is straight and clear - the building up of a socialist democracy at home, with freedom and prosperity for all, and the maintenance of world peace and friendship with all nations abroad.","Lal Bahadur Shastri","Freedom,Home,Peace"
"We must restore hope to young people, help the old, be open to the future, spread love. Be poor among the poor. We need to include the excluded and preach peace.","Pope Francis","Hope,Peace,Future"
"The season of failure is the best time for sowing the seeds of success.","Paramahansa Yogananda","Success,Time,Best"
"Wisdom is the power to put our time and our knowledge to the proper use.","Thomas J. Watson","Time,Knowledge,Power"
"Definitely working on 'Deal or No Deal' was a learning experience, and it helped me to understand what I would rather be doing.","Meghan Markle","Experience,Me"
"When I am wrong, I will learn the lesson and move on to face other challenges. For me, that's what creating your own life is. Doing your best work while being your best self.","Jennifer Lopez","Work,Best,I Am"
"There are certain comforts of living here in Dubai, the comforts of so many mosques and so much good food... It's just that much more secure. And may God keep it safe.","Cat Stevens","Food,God,Good Food"
"Learning lessons is a little like reaching maturity. You're not suddenly more happy, wealthy, or powerful, but you understand the world around you better, and you're at peace with yourself. Learning life's lessons is not about making your life perfect, but about seeing life as it was meant to be.","Elisabeth Kubler-Ross","Life,Peace,Happy"
"The first step toward success is taken when you refuse to be a captive of the environment in which you first find yourself.","Mark Caine","Motivational,Yourself,Step"
